{
  "quantityOrderedUOM": "consectetur exercitation esse pariatur cupidatat",
  "salesOrderProductStatus": [
    {
      "id": "ut",
      "name": "aliqua"
    },
    {
      "id": "commodo aliquip pariatur ex dolor",
      "name": "in culpa"
    },
    {
      "id": "aliquip sunt sint elit",
      "name": "elit nostrud"
    },
    {
      "id": "officia nostrud in eiusmod eu",
      "name": "magna"
    },
    {
      "id": "id Duis enim in in",
      "name": "labore"
    },
    {
      "id": "id do aliqua",
      "name": "aute id deserunt"
    },
    {
      "id": "aliqua ex elit ea",
      "name": "ipsum ad laboris quis"
    },
    {
      "id": "aliquip",
      "name": "non"
    }
  ],
  "orderProductNumber": "ad in irure anim",
  "id": "mollit aliqua veniam",
  "totalPriceAmount": 49413672,
  "orderedQuantity": -70059426,
  "description": "fugiat tempor eu",
  "totalDistributedAdjustmentAmount": 42703959,
  "allocationGroupName": "qui",
  "provisioningDate": "1979-11-20",
  "availableQuantity": 95773460,
  "endDate": "1991-10-19",
  "shippingEmail": [
    "in irure ex",
    "veniam",
    "Duis incididunt sint id",
    "ea proident in aliquip aute",
    "aute sunt ea",
    "in exercitation esse dolore anim",
    "cupidatat labore ut non esse",
    "consectetur officia laboris dolore",
    "est mollit aliquip sunt fugiat",
    "proident in",
    "exercitation amet et voluptate aliqua",
    "Duis dolor"
  ],
  "totalRecurringPriceAmount": -36164162,
  "promisedDate": "1967-02-26",
  "product": [
    "laborum anim commodo",
    "irure voluptate adipisicing mollit in",
    "ullamco Ut ea",
    "nulla",
    "ea cillum dolore nulla Lorem",
    "est consectetur Lorem",
    "ut deserunt incididunt",
    "Duis ipsum mollit sunt irure",
    "in",
    "culpa do",
    "Excepteur veniam",
    "veniam",
    "et ullamco est",
    "ullamco do",
    "irure adipisicing",
    "elit in laborum sunt aute",
    "dolor",
    "velit",
    "ea",
    "qui",
    "non consectetur cillum",
    "dolore",
    "ipsum quis sunt Lorem laborum",
    "qui ipsum minim Duis voluptate",
    "sit qui officia dolore",
    "commodo minim",
    "Duis dolore",
    "qui",
    "in sunt nulla",
    "ut veniam aliquip",
    "ipsum",
    "in Excepteur ut Lorem",
    "consequat voluptate",
    "Lorem",
    "in dolore",
    "laborum Lorem sit",
    "exercitation sit dolore",
    "mollit sunt nisi qui ut",
    "deserunt ex ut",
    "cillum",
    "irure ex",
    "nisi nostrud",
    "qui",
    "ullamco Ut dolore velit",
    "dolore dolore Excepteur deserunt nisi",
    "aliqua ullamco esse dolor",
    "minim adipisicing",
    "reprehenderit velit",
    "anim dolore",
    "ut ipsum non ullamco ut",
    "nisi",
    "mollit in exercitation",
    "exercitation sunt",
    "quis incididunt in laborum",
    "reprehenderit veniam",
    "eu in reprehenderit",
    "et ea irure do ullamco",
    "dolor aute minim fugiat ad",
    "proident",
    "consequat elit fugiat",
    "est",
    "cupidatat",
    "ut incididunt",
    "fugiat",
    "cillum laborum",
    "sunt ad",
    "laborum labore",
    "consectetur sint in pariatur Lorem",
    "dolor anim minim",
    "ea do veniam mollit esse",
    "in Ut qui eu",
    "proident aute",
    "esse Lorem do dolore cillum",
    "ipsum aliqua culpa aute aliquip",
    "veniam fugiat laboris dolore",
    "ipsum",
    "in ad aliquip voluptate est",
    "deserunt sed",
    "cillum tempor ex culpa",
    "fugiat in",
    "enim exercitation laborum",
    "qui veniam",
    "in",
    "dolore irure minim occaecat"
  ],
  "discountAmount": 71871371,
  "isBundleRoot": true,
  "giftRecipientTelephoneNumber": "labore in nulla",
  "discountPercent": 41825821,
  "originalOrderProduct": [
    "aliquip elit sint ut quis",
    "ut et Duis est",
    "in dolor dolore ex",
    "qui consectetur",
    "do officia aute culpa",
    "Ut ex dolor cillum sit",
    "fugiat",
    "tempor esse",
    "sint",
    "Ut",
    "deserunt dolore Duis",
    "dolor fugiat",
    "dolore nisi quis",
    "cupidatat",
    "deserunt elit ex est",
    "nisi",
    "dolore esse dolor anim non",
    "voluptate ut",
    "occaecat reprehenderit in",
    "nostrud laborum voluptate",
    "occaecat Excepteur exercitation dolor fugiat",
    "reprehenderit quis",
    "nulla ea anim do",
    "voluptate velit ipsum in do",
    "in",
    "tempor",
    "ullamco",
    "voluptate",
    "est sed enim et fugiat",
    "labore adipisicing nisi aliquip ex",
    "ullamco minim",
    "ea velit aliqua",
    "Excepteur quis nisi laboris",
    "Excepteur",
    "reprehenderit",
    "ut",
    "minim aliqua Duis officia",
    "quis Ut est non",
    "magna dolore cillum ex sit",
    "incididunt pariatur sed",
    "nisi est tempor Lorem",
    "ea Lorem officia",
    "ut id",
    "nostrud ut in culpa consequat",
    "labore voluptate",
    "aute sunt consequat nisi",
    "magna sit quis laboris culpa",
    "consectetur ea incididunt anim qui",
    "magna dolore non nisi est",
    "proident mollit",
    "aute",
    "Lorem Duis ut adipisicing amet",
    "in voluptate ut",
    "magna in",
    "minim laborum fugiat",
    "do ad",
    "irure anim et est",
    "exercitation anim qui",
    "aliqua id",
    "officia Duis reprehenderit",
    "culpa fugiat aliquip mollit",
    "proident quis elit est veniam",
    "adipisicing irure consequat nostrud",
    "incididunt esse est",
    "occaecat quis tempor",
    "ex dolor eu id ut",
    "dolor dolor amet in",
    "eiusmod sit ut anim",
    "irure sit esse in laboris",
    "in laborum pariatur non",
    "voluptate dolore est nisi in",
    "enim sed aliqua",
    "eu minim dolore occaecat elit",
    "laboris",
    "aute adipisicing occaecat",
    "dolor anim do quis commodo",
    "non",
    "reprehenderit ut voluptate",
    "sit",
    "dolore ipsum",
    "elit",
    "fugiat culpa in sint",
    "qui laborum esse minim",
    "sunt aliqua sint",
    "enim",
    "amet incididunt irure fugiat non",
    "est veniam magna enim"
  ],
  "isAutomaticallyRenewed": false,
  "totalLineAmount": 79010671,
  "isBonusProduct": false,
  "totalLineAdjustmentAmount": -67703808,
  "subscriptionTermQuantity": -72898391,
  "cancelledQuantity": -59845915,
  "totalManualAdjustmentAmount": 12471631,
  "salesOrderDeliveryGroup": [
    "proident in Lorem deserunt",
    "proident sed enim",
    "eu Excepteur",
    "nisi",
    "non reprehenderit proident",
    "elit laborum consectetur",
    "aliquip ipsum",
    "qui quis do aliquip veniam",
    "eu aute cupidatat eiusmod in",
    "dolore ex irure consequat eu",
    "irure in",
    "in anim qui",
    "cillum tempor sint esse ullamco",
    "fugiat",
    "amet",
    "in in Lorem ea commodo",
    "esse enim sunt",
    "pariatur ad Excepteur et",
    "cillum",
    "aliquip voluptate",
    "Ut",
    "in sunt",
    "cupidatat",
    "sunt",
    "adipisicing et",
    "aliqua cillum",
    "sint in",
    "tempor",
    "reprehenderit fugiat",
    "deserunt velit ea dolore reprehenderit",
    "ut ea",
    "aliquip",
    "consequat",
    "dolore eu esse",
    "tempor ex",
    "qui",
    "exercitation",
    "enim",
    "sed",
    "eiusmod",
    "voluptate",
    "ullamco dolore",
    "ullamco sunt amet culpa",
    "dolore Ut sunt commodo labore",
    "aute dolor non enim anim",
    "ipsum veniam non",
    "dolor aliquip in ipsum",
    "deserunt commodo ullamco veniam exercitation",
    "commodo nostrud",
    "elit Ut officia eu veniam",
    "officia aliquip in",
    "proident officia pariatur",
    "laboris",
    "dolore id dolor aliqua",
    "elit anim occaecat laborum veniam",
    "officia voluptate adipisicing irure sit",
    "dolor",
    "incididunt in labore Lorem laborum",
    "incididunt",
    "sint aute Ut minim veniam",
    "labore et in Excepteur",
    "reprehenderit",
    "ex enim",
    "commodo",
    "elit Lorem aute",
    "et",
    "proident nisi quis labore sint",
    "est sed dolore",
    "consectetur qui in cillum",
    "cupidatat Duis adipisicing exercitation",
    "qui elit eu laborum ullamco",
    "qui",
    "reprehenderit in aliqua esse",
    "officia cupidatat enim nostrud",
    "in ut",
    "Ut ipsum incididunt",
    "ea Excepteur culpa",
    "nisi",
    "in quis amet",
    "adipisicing consectetur",
    "occaecat culpa fugiat enim",
    "quis laboris ex est dolore",
    "veniam commodo dolore culpa dolor",
    "dolor aute Ut do deserunt",
    "adipisicing ipsum",
    "deserunt aute non",
    "culpa",
    "ex eu fugiat sint cillum",
    "laborum",
    "aliquip",
    "tempor elit",
    "quis eiusmod Excepteur",
    "eiusmod quis sit deserunt",
    "enim ullamco voluptate aliqua",
    "incididunt irure",
    "sint"
  ]
}
